{
  "item_id": "11111111-1111-4111-8111-111111111111",
  "status": "restored",
  "restored_path": "C:\\SyntheticScratch\\sample.tmp",
  "restored_at": "2026-07-11T08:05:00Z",
  "overwrite_performed": false,
  "evidence": [{"source": "quarantine_manifest", "fact": "synthetic SHA-256 and destination checks passed"}]
}
